"conversation_id_str","created_at","favorite_count","full_text","id_str","image_url","in_reply_to_screen_name","lang","location","quote_count","reply_count","retweet_count","tweet_url","user_id_str","username"
"1847474686080536958","Sat Oct 19 03:07:44 +0000 2024","5","Berangkat dr belanja masalah di pasar Munjul #PramDoel bertekad meninjau ulang restribusi yg mahal dan akan melanjutkan pembangunan pasar yg mangkrak. Alhamdulillah #JakartaMenyala https://t.co/rto4BZpMXn","1847474686080536958","https://pbs.twimg.com/ext_tw_video_thumb/1847474591553523712/pu/img/mgNXMwWe47Nrlry8.jpg","","in","","0","1","4","https://x.com/siapanamina/status/1847474686080536958","1402653576090984450","siapanamina"
"1847472224229609678","Sat Oct 19 03:05:03 +0000 2024","1","@_riverheaven @pramonoanung Sukseskan Pilkada Serentak 2024 dgn damai aman dan riang gembira #JakartaMenyala ","1847474010457854285","","_riverheaven","in","Andalas ","0","0","0","https://x.com/DioR3born/status/1847474010457854285","1375383266425888777","DioR3born"
"1847473600317837728","Sat Oct 19 03:03:25 +0000 2024","17","Warung Madura buka 24 jam Emang bisa? Salah satu komitmen Pramono doel ketika terpilih mjd Gubernur DKJ adalah memastikan warung Madura tetap bisa buka 24 jam dan akan aktifkan BLK tuk tingkatkan SDM masyarakat Jakarta. #JakartaMenyala https://t.co/isXEL1MewD","1847473600317837728","https://pbs.twimg.com/ext_tw_video_thumb/1847348499714891776/pu/img/TXpefTL_pX-YGrbB.jpg","","in","PLUIT","0","2","13","https://x.com/KangManto123/status/1847473600317837728","947632364003368961","KangManto123"
"1847473128769011734","Sat Oct 19 03:01:32 +0000 2024","6","Bismillah... Niat tulus membawa #JakartaMenyala pasti didukung Warga Jakarta dan dihijabahi Allah SWT. Aamiin ProgramÂ² #PrakarUntukJakarta tidak omonÂ² saja...apalagi janji palsu asal kepilih saja. You know yaa... https://t.co/r2PVsB20Ll","1847473128769011734","https://pbs.twimg.com/media/GaOLBRSbUAEcaXz.jpg","","in","","0","2","5","https://x.com/siapanamina/status/1847473128769011734","1402653576090984450","siapanamina"
"1847472907322347684","Sat Oct 19 03:00:40 +0000 2024","0","Rano Karno Janji Jalankan Program Makan Bergizi Gratis Prabowo di Jakarta JAKARTA - Calon Wakil Gubernur (Cawagub) Jakarta Rano Karno memastikan akan menjalankan program pemerintah pusat termasuk makan bergizi gratis. #JakartaMenyala https://t.co/ck9hBMJtiL","1847472907322347684","https://pbs.twimg.com/media/GaOKlElaIAA-AVk.jpg","","in","DKI Jakarta, Indonesia","0","1","0","https://x.com/tvspartanindo/status/1847472907322347684","1710643052707209216","tvspartanindo"
"1847472282878542187","Sat Oct 19 02:58:11 +0000 2024","67","Ini baru benar uang rakyat digunakan unk rakyat bukan untuk pejabat dan keluarganya yg sdh selesai menjabat. Dukung Industri Kreatif dan UMKM di Jakarta Cagub Pramono Bakal Siapkan Hibah Rp3 3 Triliun Dari APBD. #JakartaMenyala https://t.co/tH2wxCrzKT https://t.co/xm3krnTryU","1847472282878542187","https://pbs.twimg.com/media/GaOKQAUbIAA9zp9.jpg","","in","Kalimantan Timur, Indonesia","1","4","33","https://x.com/ch_chotimah2/status/1847472282878542187","154435354","ch_chotimah2"
"1847472256320229804","Sat Oct 19 02:58:04 +0000 2024","14","Blusukan ke Koja Pramono Anung janji akan mendirikan SLB (Sekolah luar biasa) Selain SLB Pramono juga akan memberikan dana bantuan usaha dan pelatihan kerja kpd penyandang Disabilitas #JakartaMenyala https://t.co/6yRbCXW7nR","1847472256320229804","https://pbs.twimg.com/media/GaOKOSpbUAAMb7d.jpg","","in","PLUIT","1","1","10","https://x.com/KangManto123/status/1847472256320229804","947632364003368961","KangManto123"
"1847472224229609678","Sat Oct 19 02:57:57 +0000 2024","25","Pagi-pagi dah #HebohBanget nonton Alip Baihak nge-roasting Mas Pram Di Roasting bukannya sewot tegang atau jaim...laah Mas @pramonoanung malah Ngakak . . Jakarta itu rumah besar bagi industri kreatif Mas Pram - Bang Doel akan memberikan ruang agar komika #JakartaMenyala https://t.co/Kbnz6bCL9n","1847472224229609678","https://pbs.twimg.com/ext_tw_video_thumb/1847471799325675520/pu/img/06P0HNOWuzh_PivH.jpg","","in","Andalas ","0","4","15","https://x.com/DioR3born/status/1847472224229609678","1375383266425888777","DioR3born"
"1847471463491916014","Sat Oct 19 02:54:55 +0000 2024","9","Pramono Anung Janji Tambah Jumlah SLB di Jakarta Utara jika Jadi Gubernur. Karena menurut beliau pemerintah memang semestinya hadir untuk memfasilitasi para penyandang disabilitas. #JakartaMenyala https://t.co/y0jfwp1UHt","1847471463491916014","https://pbs.twimg.com/media/GaOJgUVbcAA4ilz.jpg","","in","","0","0","7","https://x.com/BungkusTukang/status/1847471463491916014","1168705905015148546","BungkusTukang"
"1847397850168381448","Sat Oct 19 02:31:24 +0000 2024","1","@AntoniusCDN @pramonoanung @JhonSitorus_18 @Anak__Ogi @03__nakula @NgkongRoses @seruanhl @elsaday__ @DS_yantie @Eil_Thia @ch_chotimah2 UMKM senang rakyat pun riang! #JakartaMenyala","1847465544771096668","","AntoniusCDN","in","Indonesia","0","0","0","https://x.com/HumorJonTampan/status/1847465544771096668","257090687","HumorJonTampan"
"1847418079099355579","Sat Oct 19 02:30:37 +0000 2024","2","@Cintada16 @AntoniusCDN Karena budaya adalah identitas bangsa! #JakartaMenyala #PrakarUntukJakarta","1847465344442782062","","Cintada16","in","Indonesia","0","0","0","https://x.com/HumorJonTampan/status/1847465344442782062","257090687","HumorJonTampan"
"1847455371394511204","Sat Oct 19 02:30:04 +0000 2024","1","@mulanbilqis Untuk #JakartaMenyala ","1847465208639606979","","mulanbilqis","in","ðŸ‡®ðŸ‡©","0","0","1","https://x.com/elsaday__/status/1847465208639606979","1316243860280889345","elsaday__"
"1847465028443918536","Sat Oct 19 02:29:21 +0000 2024","11","Mas Pram - Bang Doel dalam programnya berkomitmen jika terpilih nanti akan memajukan budaya Betawi . Nah ini pemimpin yang peduli dengan pelestarian budaya daerah bukan pemimpin yang mengadopsi budaya luar untuk diterapkan di wilayahnya . #JakartaMenyala https://t.co/dGvpqhLlWR","1847465028443918536","https://pbs.twimg.com/media/GaODptabUAAwfPB.jpg","","in","","0","1","7","https://x.com/BungkusTukang/status/1847465028443918536","1168705905015148546","BungkusTukang"
"1847465022051742180","Sat Oct 19 02:29:20 +0000 2024","19","Melihat video ini kok vibesnya berasa banget jika @pramonoanung InshaaAllah akan memimpin Jakarta dengan amanah dan adil. PramDoel untuk #JakartaMenyala #PrakarUntukJakarta --- Pagi-pagi Indah G Bernadya TumbangkanFufufafa Hasto Yahya Sinwar https://t.co/ZSnNQe4DnV","1847465022051742180","https://pbs.twimg.com/ext_tw_video_thumb/1847464958269026304/pu/img/d_AnCeUV2ywgHm63.jpg","","in","","0","0","8","https://x.com/_riverheaven/status/1847465022051742180","975389335775199232","_riverheaven"
"1847464010863825076","Sat Oct 19 02:25:19 +0000 2024","52","Inilah Ide Keren Mas Pram dan Bang Doel Kalo klean kepingin Jakarta punya tempat tinggal yg terjangkau punya ruang u/ berkarya &amp; berinovasi jawabannya jelas Dukung 03 Pramono Anung-Rano Karno @pramonoanung #JakartaMenyala #PrakarUntukJakarta https://t.co/AkdZ1D2F6e","1847464010863825076","https://pbs.twimg.com/ext_tw_video_thumb/1847463943234867200/pu/img/uKkCdKdjUuqanhEf.jpg","","in","Selakartika","0","1","36","https://x.com/denni_sauya/status/1847464010863825076","1249352392954368001","denni_sauya"
"1847462925319229902","Sat Oct 19 02:21:00 +0000 2024","168","Rocky Gerung dukung paslon mas Pram-bang Doel untuk Jakarta lebih melenting. #JakartaMenyala https://t.co/KtEYIN48n3","1847462925319229902","https://pbs.twimg.com/media/GaOBvWYbAAAu7gW.jpg","","in","Indonesia","1","21","31","https://x.com/narkosun/status/1847462925319229902","84221579","narkosun"
"1847300490587169265","Sat Oct 19 02:19:40 +0000 2024","1","@nongandah @rockygerung Berjuang utk #jakartamenyala ","1847462590181699841","","nongandah","in","south of saudi arabia area","0","0","0","https://x.com/TutupG56821/status/1847462590181699841","1749701641912340480","TutupG56821"
"1847461508357509138","Sat Oct 19 02:15:22 +0000 2024","15","Kewajiban pemerintah untuk memajukan kebudayaan Betawi merupakan amanat dari pasal 31 Undang-Undang Nomor 2 Tahun 2024 tentang Daerah Khusus Jakarta. Kami yakin amanah untuk memajukan kebudayaan Betawi bisa diwujudkan @pramonoanung-@ranodoelkarno #JakartaMenyala https://t.co/tiJ7Q6w6EK","1847461508357509138","https://pbs.twimg.com/media/GaOAc35bUAIoWQC.jpg","","in","","1","4","12","https://x.com/DS_yantie/status/1847461508357509138","1374686160748830724","DS_yantie"
"1847460287538242035","Sat Oct 19 02:10:31 +0000 2024","16","Mas Pram Muda Sangat IDEALIS DINAMIS dab PROGRESIF Menjadi TARGET Rezim ORDE BARU Untuk Diamankan . Sampai - sampai Orang Tuanya DiINTIMIDASI Supaya Anaknya Jangan Terlalu KERAS .. #JakartaMenyala Siap Melawan Ketidakadilan https://t.co/WZLM74b4T1","1847460287538242035","https://pbs.twimg.com/ext_tw_video_thumb/1847460205627645952/pu/img/Bba7nN8IJhF1ZVlL.jpg","","in","Solo (Bekasi Timur), Indonesia","0","2","8","https://x.com/SETYAKI22965702/status/1847460287538242035","1322361095407902721","SETYAKI22965702"
"1847425122535428427","Sat Oct 19 02:05:50 +0000 2024","1","@Penyair_Berdiri @Ari3Pras Prakar Untuk Jakarta #JakartaMenyala ","1847459109794390096","","Penyair_Berdiri","in","DIHATIMU","0","0","0","https://x.com/Cintada16/status/1847459109794390096","1279643013455605760","Cintada16"
"1847444117107986805","Sat Oct 19 02:04:57 +0000 2024","0","@Penyair_Berdiri Mas Pram Bang Doel pemimpin inklusif siap bikin #JakartaMenyala","1847458887357911381","","Penyair_Berdiri","in","Indonesia","0","0","0","https://x.com/Ari3Pras/status/1847458887357911381","4200694752","Ari3Pras"
"1847458033200484406","Sat Oct 19 02:01:33 +0000 2024","0","Dukungan dari FBR dan Forkabi menunjukkan bahwa Pramono Anung dan Rano Karno memiliki kekuatan untuk membangun Jakarta bersama #JakartaMenyala https://t.co/UJiub3EvDv","1847458033200484406","https://pbs.twimg.com/media/GaN9RkebEAArMcc.jpg","","in","","0","0","0","https://x.com/rsy4me/status/1847458033200484406","2400487987","rsy4me"
"1847457773094916098","Sat Oct 19 02:00:31 +0000 2024","0","Pramono Anung adalah sosok pemimpin yang berakar dari masyarakat. Dengan dukungan dari FBR dan Forkabi ia menunjukkan bahwa ia memahami kebutuhan dan harapan masyarakat Betawi #JakartaMenyala https://t.co/AOdlWHgoSu","1847457773094916098","https://pbs.twimg.com/media/GaN9CTqbgAA0uq7.jpg","","in","","0","0","0","https://x.com/rsy4me/status/1847457773094916098","2400487987","rsy4me"
"1847456280878961114","Sat Oct 19 02:00:01 +0000 2024","1","@TOM5helby @pramonoanung @ranodoelkarno Mantap #JakartaMenyala ","1847457645533548627","","TOM5helby","in","DIHATIMU","0","0","0","https://x.com/Cintada16/status/1847457645533548627","1279643013455605760","Cintada16"
"1847457403417350171","Sat Oct 19 01:59:03 +0000 2024","0","Melalui program-program yang direncanakannya Pramono Anung ingin memastikan bahwa budaya Betawi tetap hidup dan berkembang #JakartaMenyala https://t.co/5rSyxu75Db","1847457403417350171","https://pbs.twimg.com/media/GaN8thwaAAAHm_b.jpg","","in","","0","0","0","https://x.com/rsy4me/status/1847457403417350171","2400487987","rsy4me"
"1847457158956536170","Sat Oct 19 01:58:05 +0000 2024","0","Dengan dukungan dari dua organisasi besar Betawi Pramono Anung bertekad untuk mewujudkan Jakarta yang berbudaya. Ia percaya bahwa budaya Betawi harus menjadi bagian penting dari pembangunan kota #JakartaMenyala https://t.co/WeSRwUVt8O","1847457158956536170","https://pbs.twimg.com/media/GaN8e30awAENkhM.jpg","","in","","0","0","0","https://x.com/rsy4me/status/1847457158956536170","2400487987","rsy4me"
"1847455371394511204","Sat Oct 19 01:57:46 +0000 2024","2","@mulanbilqis Tokoh Pemimpin Kolaboratif untuk #JakartaMenyala","1847457079361229274","","mulanbilqis","in","Indonesia","0","0","1","https://x.com/Ari3Pras/status/1847457079361229274","4200694752","Ari3Pras"
"1847456881713041762","Sat Oct 19 01:56:59 +0000 2024","0","Dukungan dari dua organisasi besar menunjukkan bahwa Pramono Anung berkomitmen untuk melestarikan budaya Betawi. Ia berjanji untuk mengintegrasikan budaya lokal dalam setiap kebijakan yang diambil sehingga masyarakat merasa dihargai dan diakomodasi #JakartaMenyala https://t.co/4FuwbSpQgk","1847456881713041762","https://pbs.twimg.com/media/GaN8PB_b0AAVPmU.jpg","","in","","0","0","0","https://x.com/rsy4me/status/1847456881713041762","2400487987","rsy4me"
"1847456575549771953","Sat Oct 19 01:55:46 +0000 2024","0","Dengan dukungan dari Forkabi dan FBR Pramono Anung dipandang sebagai sosok yang mampu memperjuangkan kesejahteraan masyarakat Betawi. Ia memiliki rencana konkret untuk meningkatkan taraf hidup dan memberikan perhatian lebih kepada masyarakat yang membutuhkan #JakartaMenyala https://t.co/h9nSn11tbS","1847456575549771953","https://pbs.twimg.com/media/GaN79VGbIAEFCtQ.jpg","","in","","0","0","0","https://x.com/rsy4me/status/1847456575549771953","2400487987","rsy4me"
"1847456280878961114","Sat Oct 19 01:54:36 +0000 2024","37"," Membangun Jakarta harus berbasis kebudayaan Itu adalah janji mas @pramonoanung dan @ranodoelkarno untuk #JakartaMenyala Jangan lagi pembangunan kota justru menggerus kearifan lokal dan budaya. https://t.co/adVQxQD3L9","1847456280878961114","https://pbs.twimg.com/amplify_video_thumb/1847456209902981120/img/A-4bgI_y91UgiK8U.jpg","","in","Bali, Indonesia","0","3","17","https://x.com/TOM5helby/status/1847456280878961114","1426438140202348546","TOM5helby"
"1847456119939326359","Sat Oct 19 01:53:57 +0000 2024","25","Wah mantap ni Mas Pram akan tinjau ulang retribusi pedagang dan melanjutkan pembangunan pasar Munjul.. Mas Pram akan selalu berpihak pada rakyat. #PrakarUntukJakarta #JakartaMenyala https://t.co/sfDrWj6Vjf","1847456119939326359","https://pbs.twimg.com/ext_tw_video_thumb/1847455907191603200/pu/img/_dk8-db9XX8B3se5.jpg","","in","DIHATIMU","0","1","14","https://x.com/Cintada16/status/1847456119939326359","1279643013455605760","Cintada16"
"1847455857057157258","Sat Oct 19 01:52:55 +0000 2024","0","Pramono Anung - Rano Karno berkomitmen untuk menghadirkan program-program yang akan meningkatkan kualitas hidup masyarakat dan memperkuat identitas budaya Betawi #JakartaMenyala https://t.co/0pvQjl05TD","1847455857057157258","https://pbs.twimg.com/media/GaN7SWgboAAVFI-.jpg","","in","","0","0","0","https://x.com/thejoyofus/status/1847455857057157258","1838601635993653253","thejoyofus"
"1847455582305079342","Sat Oct 19 01:51:49 +0000 2024","0","Dukungan dari dua ormas besar menegaskan bahwa Pramono Anung memiliki visi untuk membangun Jakarta bersama masyarakat Betawi #JakartaMenyala https://t.co/DBjViG2dkK","1847455582305079342","https://pbs.twimg.com/media/GaN7DR6bkAAbGW3.jpg","","in","","0","0","0","https://x.com/thejoyofus/status/1847455582305079342","1838601635993653253","thejoyofus"
"1847455371394511204","Sat Oct 19 01:50:59 +0000 2024","23","Penghargaan detikcom Awards 2024 TOKOH PEMIMPIN KOLABORATIF diraih oleh Pramono Anung. Artinya kualitas kepemimpinan Mas PRAM gak perlu diragukan lagi. Jakarta kota kolaboratif butuh pemimpin sekelas Pramono Anung. #JakartaMenyala #PrakarUntukJakarta https://t.co/vvj6oRMzi5","1847455371394511204","https://pbs.twimg.com/media/GaN63QKbUAMOydS.jpg","","in","twitter.com","1","8","18","https://x.com/mulanbilqis/status/1847455371394511204","1138727688","mulanbilqis"
"1847455258815189352","Sat Oct 19 01:50:32 +0000 2024","20","Mas Pram pastikan warung Madura bisa buka 24 jam... Mas Pram selalu memberikan solusi/ide untuk mensejahterakan warga Jakarta. #PrakarUntukJakarta #JakartaMenyala https://t.co/e0Vqr1wt7j","1847455258815189352","https://pbs.twimg.com/ext_tw_video_thumb/1847453258572582916/pu/img/HzawV047gJ2bcYHh.jpg","","in","DIHATIMU","0","2","14","https://x.com/Cintada16/status/1847455258815189352","1279643013455605760","Cintada16"
"1847455246597181929","Sat Oct 19 01:50:29 +0000 2024","0","Dukungan yang mengalir dari FBR &amp; Forkabi adalah bukti nyata bahwa Pramono Anung pribadi yang aktif mendengarkan aspirasi dan keluhan warga menjadikannya pilihan yang tepat dalam Pilkada Jakarta #JakartaMenyala https://t.co/yCTHP50gI8","1847455246597181929","https://pbs.twimg.com/media/GaN6uFIbIAAqOcS.jpg","","in","","0","0","0","https://x.com/thejoyofus/status/1847455246597181929","1838601635993653253","thejoyofus"
"1847454488027877786","Sat Oct 19 01:47:28 +0000 2024","0","Dengan dukungan dari dua ormas besar Pramono Anung diharapkan dapat menjadi jembatan antara generasi tua dan muda masyarakat Betawi. Ia memiliki visi yang menggabungkan nilai-nilai tradisi dengan kebutuhan modernisasi sehingga budaya Betawi tetap terjaga #JakartaMenyala https://t.co/YBjo8qNr7j","1847454488027877786","https://pbs.twimg.com/media/GaN6C5PboAAI84y.jpg","","in","","0","0","0","https://x.com/thejoyofus/status/1847454488027877786","1838601635993653253","thejoyofus"
"1847453885545533895","Sat Oct 19 01:45:05 +0000 2024","11","Sebut Blusukan Jadi Kebiasaan Pramono: Kalau Enggak Keliling Jakarta Saya Malah Stres. #JakartaMenyala #PrakarUntukJakarta https://t.co/cUL2VnUFie","1847453885545533895","https://pbs.twimg.com/ext_tw_video_thumb/1847453786274766848/pu/img/dIVOAcsF2Inm_ynf.jpg","","in","lokalisasi kelas teri","0","0","9","https://x.com/triwul82/status/1847453885545533895","2695463725","triwul82"
"1847453693979037889","Sat Oct 19 01:44:19 +0000 2024","5","Keinginan Pramono menambah SLB di Jakarta Utara berawal dari keluhan warga bernama Upi Apriyani yang merupakan pemilik Rumah Quran Disabilitas Jakarta Utara. #pramdoelmenang #jakartamenyala #pramdoelmenyala #pramdoel #jakartam3nyala #prakaruntukjakarta https://t.co/TkcnVXUYtF","1847453693979037889","https://pbs.twimg.com/media/GaN5VmsbUAAY15s.jpg","","in","","0","0","4","https://x.com/Ganjarfor_ri/status/1847453693979037889","1691672652929445888","Ganjarfor_ri"
"1847451992752607464","Sat Oct 19 01:37:33 +0000 2024","22","Pramono Anung Janji Tinjau Ulang Retribusi pedagang Pasar Munjul . . . . #JakartaMenyala #PrakarUntukJakarta https://t.co/gm90BddL0J","1847451992752607464","https://pbs.twimg.com/ext_tw_video_thumb/1847451965388967936/pu/img/J2x4xwMD0QRtSmGZ.jpg","","in","","1","4","21","https://x.com/B3doel___/status/1847451992752607464","1351138416088510467","B3doel___"
"1847451952403333257","Sat Oct 19 01:37:24 +0000 2024","3","@pramonoanung meraih penghargaan detikcom award 2024 sebagai TOKOH TOKOH PEMIMPIN KOLABORATIF nominasi ini menyoroti kemampuan pramono anung dalam membangun kerjasama lintas sektor baik dengan eksekutif legeslatif maupun dengan tokohÂ² politik lain nya #JakartaMenyala https://t.co/4xdonNdeLr","1847451952403333257","https://pbs.twimg.com/media/GaN3wX_bUAAznqq.jpg","pramonoanung","in","","0","0","3","https://x.com/breakingNEW_upd/status/1847451952403333257","1463720993176784901","breakingNEW_upd"
"1847449721813811364","Sat Oct 19 01:28:32 +0000 2024","0","Dukungan dari Forkabi &amp; FBR menegaskan bahwa Pramono Anung adalah harapan baru bagi masyarakat Betawi. Keberanian dan komitmennya untuk memperjuangkan hak-hak masyarakat menjadikannya calon pemimpin yang layak diperhitungkan dalam Pilkada Jakarta #JakartaMenyala https://t.co/Njhgxa8VXx","1847449721813811364","https://pbs.twimg.com/media/GaN1mPfbUAAE0oD.jpg","","in","","0","0","0","https://x.com/thejoyofus/status/1847449721813811364","1838601635993653253","thejoyofus"
"1847449140441313716","Sat Oct 19 01:26:13 +0000 2024","2","Mas @pramonoanung Meraih https://t.co/rJaBDi2agh AWARD 2024 Sebagai Tokoh Pemimpin Kolaboratif Didalam Dunia Polituk Mas PRAM Dikenal Sebagai Sosok yg Mampu Membangun Sinergitas Ke Berbagai Pihak Utk Mencapai Tujuan Bersama. #JakartaMenyala Bersama PRAKAR 2024 - 2029 https://t.co/M7UEVCP2xR","1847449140441313716","https://pbs.twimg.com/ext_tw_video_thumb/1847449109399293953/pu/img/0YoRfsnZVXnw5B6Y.jpg","","in","Solo (Bekasi Timur), Indonesia","0","1","2","https://x.com/SETYAKI22965702/status/1847449140441313716","1322361095407902721","SETYAKI22965702"
"1847448868478472688","Sat Oct 19 01:25:08 +0000 2024","30","Malah Ketawa Ngakak Di-roasting Komika Alip Baihak Sebut Pramono 'Woles' #JakartaMenyala #PrakarUntukJakarta https://t.co/w6OiBGyiDh","1847448868478472688","https://pbs.twimg.com/ext_tw_video_thumb/1847448831774048256/pu/img/SyHHv5V3HOyhy1Ow.jpg","","in","lokalisasi kelas teri","0","0","14","https://x.com/triwul82/status/1847448868478472688","2695463725","triwul82"
"1847448352444838098","Sat Oct 19 01:23:05 +0000 2024","0","Dukungan FBR &amp; Forkabi untuk Pramono Anung menjadi sinyal kuat bahwa perubahan positif dalam masyarakat Betawi bukan lagi sekadar harapan. Pramono adalah sosok yg mampu memenuhi ekspektasi masyarakat &amp; menjadikan Jakarta sebagai tempat yang lebih baik bagi semua #JakartaMenyala https://t.co/kMjacoyP0i","1847448352444838098","https://pbs.twimg.com/media/GaN0eXNaIAAoovH.jpg","","in","","0","0","0","https://x.com/thejoyofus/status/1847448352444838098","1838601635993653253","thejoyofus"
"1847447832929911213","Sat Oct 19 01:21:01 +0000 2024","0","Dukungan FBR &amp; FORKABI bukti bahwa Pramono Anung bukan hanya sekadar calon tetapi pemimpin yg telah mendapatkan pengakuan dari 2 ormas terbesar di Betawi. Ini mencerminkan kepercayaan masyarakat terhadap kapasitas Pramono dalam memperjuangkan aspirasi mereka #JakartaMenyala https://t.co/D9RA2QYgM2","1847447832929911213","https://pbs.twimg.com/media/GaNz9_rbUAIAjL5.jpg","","in","","0","0","0","https://x.com/thejoyofus/status/1847447832929911213","1838601635993653253","thejoyofus"
"1847447787291759070","Sat Oct 19 01:20:51 +0000 2024","17","Mas Pramono akan tetap melanjutkan program2 yg baik dari gubernur Jakarta terdahulu dan memperbaiki yg kurang. #JakartaMenyala #PrakarUntukJakarta https://t.co/34y9ysEbc6","1847447787291759070","https://pbs.twimg.com/ext_tw_video_thumb/1847447743968792583/pu/img/rlYjLVZekMtOZ9gw.jpg","","in","lokalisasi kelas teri","0","0","9","https://x.com/triwul82/status/1847447787291759070","2695463725","triwul82"
"1847447217201893590","Sat Oct 19 01:18:35 +0000 2024","3","selamat ulang tahun yg ke 73 kepada presiden terpilih pak prabowo subianto sehat selalu panjang umur dan semoga di bawah kepimpinanan beliau bangsa ini menjadi lebih baik dan persoalanÂ² ekonomi dintuntaskan Aamiin #JakartaMenyala #PrakarUntukIndonesia https://t.co/BXJj8bGq1C","1847447217201893590","https://pbs.twimg.com/media/GaNzc7-bUAMLyXy.jpg","","in","","0","0","4","https://x.com/doctor__fabre/status/1847447217201893590","1227492565525491713","doctor__fabre"
"1847446923420279069","Sat Oct 19 01:17:25 +0000 2024","18","Jika dipercaya untuk memimpin Jakarta Pramono-Bang DOEL berkomitmen akan mengangkat dan memajukan budaya Betawi. #JakartaMenyala #PrakarUntukJakarta https://t.co/bHuplzJk4V","1847446923420279069","https://pbs.twimg.com/media/GaNzLirbUAYDVa_.jpg","","in","twitter.com","1","3","12","https://x.com/mulanbilqis/status/1847446923420279069","1138727688","mulanbilqis"
"1847445885363638437","Sat Oct 19 01:13:17 +0000 2024","0","Dengan dukungan 2 organisasi besar Betawi Pramono Anung diharapkan dapat membawa Jakarta menuju masa depan yang lebih baik. Ia memiliki visi yang jelas untuk mengatasi berbagai tantangan yang dihadapi Jakarta termasuk kebudayaan dan kesejahteraan masyarakat #JakartaMenyala https://t.co/74z5jOEBgD","1847445885363638437","https://pbs.twimg.com/media/GaNyOt8bUAQYMjC.jpg","","in","","0","0","0","https://x.com/SaguKeju8/status/1847445885363638437","1424746853346660357","SaguKeju8"
"1847445371997606115","Sat Oct 19 01:11:15 +0000 2024","0","Pramono Anung dikenal sebagai pemimpin yang mendengarkan dan memahami aspirasi masyarakat. Dalam berbagai kesempatan ia menunjukkan komitmennya untuk memperjuangkan kesejahteraan masyarakat Betawi #JakartaMenyala https://t.co/9Le0wJMY3r","1847445371997606115","https://pbs.twimg.com/media/GaNxv7cbIAAyd_C.jpg","","in","","0","0","0","https://x.com/SaguKeju8/status/1847445371997606115","1424746853346660357","SaguKeju8"
"1847445010205331550","Sat Oct 19 01:09:48 +0000 2024","0","Pasangan Pramono Anung dan Rano Karno dianggap sebagai duo ideal untuk memimpin Jakarta. Dengan latar belakang yang kuat dalam politik dan budaya mereka berdua memiliki potensi untuk membawa Jakarta ke arah yang lebih baik #JakartaMenyala https://t.co/PfRjhBZ0Qa","1847445010205331550","https://pbs.twimg.com/media/GaNxb9dbUAAlSjp.jpg","","in","","0","0","0","https://x.com/SaguKeju8/status/1847445010205331550","1424746853346660357","SaguKeju8"
"1847444769552880106","Sat Oct 19 01:08:51 +0000 2024","0","Dalam deklarasi dukungan Pramono berjanji untuk mengembangkan program-program yang akan mengangkat harkat dan martabat budaya Betawi menjadikannya sebagai bagian integral dari identitas Jakarta #JakartaMenyala https://t.co/Y3nZMJVEjH","1847444769552880106","https://pbs.twimg.com/media/GaNxNtebEAAizzJ.jpg","","in","","0","0","0","https://x.com/SaguKeju8/status/1847444769552880106","1424746853346660357","SaguKeju8"
"1847444598739914991","Sat Oct 19 01:08:10 +0000 2024","0","Dukungan dari FBR dan Forkabi menegaskan bahwa Pramono Anung memiliki visi yang jelas untuk melestarikan dan memajukan budaya Betawi #JakartaMenyala https://t.co/5Uk4EU71B1","1847444598739914991","https://pbs.twimg.com/media/GaNxC8xbUAEYCHd.jpg","","in","","0","0","0","https://x.com/SaguKeju8/status/1847444598739914991","1424746853346660357","SaguKeju8"
"1847444146979823653","Sat Oct 19 01:06:23 +0000 2024","0","Pramono Anung - Rano Karno mendapat dukungan kuat dari FBR &amp; FORKABI dalam Pilkada Jakarta 2024. Dukungan ini menunjukkan bahwa Pramono adalah calon gubernur yang mampu memperjuangkan aspirasi masyarakat Betawi #JakartaMenyala https://t.co/Lxfw9jvLbk","1847444146979823653","https://pbs.twimg.com/media/GaNwiJebUAEnsT4.jpg","","in","","0","0","0","https://x.com/SaguKeju8/status/1847444146979823653","1424746853346660357","SaguKeju8"
