"conversation_id_str","created_at","favorite_count","full_text","id_str","image_url","in_reply_to_screen_name","lang","location","quote_count","reply_count","retweet_count","tweet_url","user_id_str","username"
"1847267421448736858","Fri Oct 18 13:24:08 +0000 2024","0","Dalam dialog terbuka bersama Koalisi Pemuda Jakarta Mas Pram mendengar langsung suara masyarakat Rawamangun. Bersama Bang Doel solusi terbaik untuk Jakarta telah dipersiapkan. Ayo bersama wujudkan Jakarta yang cerah! #JakartaMenyala #PramonoRano #PramDoelMenang https://t.co/1WPZmP4lj6","1847267421448736858","https://pbs.twimg.com/media/GaLP6hubMAAY2eb.jpg","","in","","0","0","0","https://x.com/Cak_Mamatt/status/1847267421448736858","1309001295257362432","Cak_Mamatt"
"1847267211846811711","Fri Oct 18 13:23:18 +0000 2024","1","Mas pram hadir dalam diskusi publik Koalisi Pemuda Jakarta di Rawamangun Jakarta Timur membahas solusi konkret untuk tantangan Jakarta. Bersama warga Mas Pram dan Bang Doel siap membawa perubahan. Dukung Jakarta yang lebih baik! #JakartaMenyala #PramonoRano #PramDoelMenang https://t.co/feEuHiQdcL","1847267211846811711","https://pbs.twimg.com/media/GaLPuhjaIAAagwf.jpg","","in","","0","0","0","https://x.com/AMainuri/status/1847267211846811711","1300702000569409536","AMainuri"
"1847267055244132789","Fri Oct 18 13:22:41 +0000 2024","0","ProgramÂ Benyamin S AwardÂ yang diusung pasangan Pramono Anung dan Rano Karno dalam ajang Pilgub 2024 dinilai sebagai strategi yang ideal untuk menjadikan Jakarta sebagai Kota Global. (Pengamat tata kota Nirwono Yoga) #jakartamenyala https://t.co/Wek1R6g8kn","1847267055244132789","https://pbs.twimg.com/ext_tw_video_thumb/1847266802340139008/pu/img/g6U7-3AIKajS9jjs.jpg","","in","","0","0","0","https://x.com/oposan62id/status/1847267055244132789","1454858092143779845","oposan62id"
"1847266713894814077","Fri Oct 18 13:21:19 +0000 2024","0","Mas Pram ingin melanjutkan ide pakn JK dan Mas Anies #JakartaMenyala #pramonoanung #pramdoelmenang #pramdoel https://t.co/yZHKkukGDY","1847266713894814077","https://pbs.twimg.com/ext_tw_video_thumb/1847266601252646912/pu/img/2_VjZq_uI-44Ibk0.jpg","","in","Jakarta Selatan, DKI Jakarta","0","0","0","https://x.com/ji_romi2/status/1847266713894814077","1708721207464603648","ji_romi2"
"1847266475209556315","Fri Oct 18 13:20:22 +0000 2024","1","#UntungnyaAdaPramDoel Jika terpilih nanti Mas Pram akan berencana menyiapkan Dana Hibah untuk UMKM agar pelaku UMKM di Jakarta lebih semangat lg krna ada tamabahan modal usaha. Mantap ! Optimis #PramDoelMenang #JakartaMenyala https://t.co/eeQL3sz6wY","1847266475209556315","https://pbs.twimg.com/media/GaLPD8obMAAn-_l.jpg","","in","indonesia","0","0","0","https://x.com/LinNasution/status/1847266475209556315","1089167212638687232","LinNasution"
"1847266275938226344","Fri Oct 18 13:19:35 +0000 2024","3","Ber-sarasehan ke pasar mendengar keluh kesah para pedagang dan para pembeli mas @pramonoanung tergerak hatinya untuk mempersiapkan dana hibah kepada para pelaku UMKM. Semoga ini bisa sedikit meringankan pegiat UMKM di Jakarta.. #JakartaMenyala https://t.co/8yzBdUZmIR","1847266275938226344","https://pbs.twimg.com/media/GaLO411bQAAw0zV.jpg","","in","Indonesia","0","0","2","https://x.com/PakarINTELek/status/1847266275938226344","194582998","PakarINTELek"
"1847264413696528390","Fri Oct 18 13:12:11 +0000 2024","0","Ketulusan dan keteguhan hati mas @pramonoanung ketika melalukan blusukan dan bertegur sapa dengan warga Jakarta dimana dan kapanpun. Semoga warga Jakarta tidak takut untuk memilih mas Pram - bang Doel nanti #JakartaMenyala https://t.co/k1OKpVOcvc","1847264413696528390","https://pbs.twimg.com/ext_tw_video_thumb/1847264375213817857/pu/img/f3t8TdNHljwFa8zs.jpg","","in","Indonesia","1","0","2","https://x.com/PakarINTELek/status/1847264413696528390","194582998","PakarINTELek"
"1847264408382448123","Fri Oct 18 13:12:10 +0000 2024","0","SLB disiapkan di Jakarta Utara oleh Gubernur Jakarta; Mas Pramono Anung. #JakartaMenyala #UntungnyaAdaPramDoel https://t.co/qCXeLAalt4","1847264408382448123","https://pbs.twimg.com/media/GaLNL4gbAAAcG22.jpg","","in","Jakarta Selatan, DKI Jakarta","0","0","0","https://x.com/Aan_Hantorov/status/1847264408382448123","1006831238961754112","Aan_Hantorov"
"1847263647963439118","Fri Oct 18 13:09:08 +0000 2024","3","Asik bgt Bang Doel kampanye ditemenin Neng Sarah siang ini di daerah Manunggal dan Setu Jakarta Timur. Seru dan akrab bgt saling sharing dgn masyarakat disana. Optimis #JakartaMenyala ! #UntungnyaAdaPramDoel https://t.co/G0NaGE7TFn","1847263647963439118","https://pbs.twimg.com/ext_tw_video_thumb/1847263610097254400/pu/img/wKlw_C3dA-LPA7H3.jpg","","in","indonesia","0","1","0","https://x.com/LinNasution/status/1847263647963439118","1089167212638687232","LinNasution"
"1847262657784824087","Fri Oct 18 13:05:12 +0000 2024","0","Dengan tantangan yang dihadapi Jakarta seperti kesenjangan informasi bagi masyarakat Pramono Anung hadir dengan solusi yang konkret. Ia berkomitmen untuk mengevaluasi dan memperbaiki program2 yang ada agar lebih tepat sasaran dan bermanfaat bagi masyarakat #JakartaMenyala https://t.co/u3tA2nQrrf","1847262657784824087","https://pbs.twimg.com/media/GaLLlrvbEAA20zy.jpg","","in","","0","0","0","https://x.com/thejoyofus/status/1847262657784824087","1838601635993653253","thejoyofus"
"1847262589673455903","Fri Oct 18 13:04:56 +0000 2024","7","Warga Jakarta akan memilih bapak Pramono karena beliau jujur dan bertanggung jawab dalam pekerjaan #JakartaMenyala https://t.co/kxnYgmb4xg","1847262589673455903","https://pbs.twimg.com/ext_tw_video_thumb/1847262529371963392/pu/img/B5d0ppDod9eiktcE.jpg","","in","DKI Jakarta, Indonesia","1","3","7","https://x.com/AleenaDi09/status/1847262589673455903","960109698895630337","AleenaDi09"
"1847262382542008676","Fri Oct 18 13:04:07 +0000 2024","0","Dengan tekadnya untuk mengimplementasikan tagline Anda Punya Hak untuk Tahu Pramono Anung menunjukkan komitmen untuk membangun masyarakat yang terinformasi. Ini adalah langkah penting untuk mendukung demokrasi dan akuntabilitas dalam pemerintahan #JakartaMenyala https://t.co/o7e8aYGSle","1847262382542008676","https://pbs.twimg.com/media/GaLLUA6a4AA3A1S.jpg","","in","","0","0","0","https://x.com/thejoyofus/status/1847262382542008676","1838601635993653253","thejoyofus"
"1847261829220962509","Fri Oct 18 13:01:55 +0000 2024","0","Dalam upayanya untuk menjadikan Jakarta sebagai kota global Pramono Anung menunjukkan kepemimpinan visioner. Ia memahami pentingnya pertukaran informasi yang baik untuk menarik perhatian dunia dan ini adalah langkah yang sangat strategis #JakartaMenyala https://t.co/j5y9s7m3Xe","1847261829220962509","https://pbs.twimg.com/media/GaLK1fFa4AAMWRH.jpg","","in","","0","0","0","https://x.com/thejoyofus/status/1847261829220962509","1838601635993653253","thejoyofus"
"1847261576241520751","Fri Oct 18 13:00:54 +0000 2024","0","Pramono Anung berkomitmen untuk meningkatkan partisipasi masyarakat dalam pengambilan kebijakan. Inisiatif ini bukan hanya demi kepentingan politik tetapi demi mewujudkan Jakarta yang lebih inklusif di mana setiap warga dapat berkontribusi dalam pembangunan kota #JakartaMenyala https://t.co/lsKXUhCqys","1847261576241520751","https://pbs.twimg.com/media/GaLKlJmaMAAbw9p.jpg","","in","","0","0","0","https://x.com/thejoyofus/status/1847261576241520751","1838601635993653253","thejoyofus"
"1847261417063567765","Fri Oct 18 13:00:16 +0000 2024","16","Calon gubernur DKI Jakarta nomor urut 3 Pramono Anung berencanaÂ mendirikan hunian di kantor atau bangunan pemerintahan selain di pasar. Keren Mas @pramonoanung #JakartaMenyala #PrakarUntukJakarta https://t.co/RgXEbdavTf","1847261417063567765","https://pbs.twimg.com/ext_tw_video_thumb/1847261375309238272/pu/img/j_4oSBi_5pbxHmOZ.jpg","","in","Pontianak, Indonesia","1","1","13","https://x.com/Sukapuring/status/1847261417063567765","2400850110","Sukapuring"
"1847261215112020079","Fri Oct 18 12:59:28 +0000 2024","0","Berkomitmen meningkatkan transparansi Pramono Anung memiliki visi yg jelas &amp; terarah untuk Jakarta. Ia tidak hanya berbicara tetapi jga beraksi untuk memastikan bahwa program2 pemerintah dapat diakses oleh semua lapisan masyarakat terutama bagi yg membutuhkan #JakartaMenyala https://t.co/ti0SlY57uo","1847261215112020079","https://pbs.twimg.com/media/GaLKRiSaAAA543q.jpg","","in","","0","0","0","https://x.com/thejoyofus/status/1847261215112020079","1838601635993653253","thejoyofus"
"1847260771518214216","Fri Oct 18 12:57:43 +0000 2024","0","Pramono Anung adalah sosok pemimpin yang mendengarkan suara rakyat. Dengan turun ke masyarakat dan mendengarkan langsung keluhan mereka ia menunjukkan bahwa ia adalah pemimpin yang peduli dan ingin memahami kebutuhan warganya #JakartaMenyala https://t.co/wjJQbNCxDc","1847260771518214216","https://pbs.twimg.com/media/GaLJ30Qa4AEzKUV.jpg","","in","","0","0","0","https://x.com/thejoyofus/status/1847260771518214216","1838601635993653253","thejoyofus"
"1847260441376063914","Fri Oct 18 12:56:24 +0000 2024","0","Pramono Anung mengusung visi yang progresif dengan menekankan pentingnya keterbukaan informasi. Komitmennya untuk menjadikan Jakarta lebih transparan adalah langkah yang sangat tepat untuk menghadapi tantangan sebagai ibu kota yang modern dan global #JakartaMenyala https://t.co/AtYmYWKunV","1847260441376063914","https://pbs.twimg.com/media/GaLJkqob0AAU37B.jpg","","in","","0","0","0","https://x.com/thejoyofus/status/1847260441376063914","1838601635993653253","thejoyofus"
"1847259761299034585","Fri Oct 18 12:53:42 +0000 2024","0","Dengan turun langsung ke lapangan Pramono Anung menunjukkan kepedulian dan komitmennya untuk memastikan bahwa semua warga Jakarta mendapatkan hak mereka diantaranya; mengakses informasi yang mereka butuhkan #JakartaMenyala https://t.co/qnMA0FXvjM","1847259761299034585","https://pbs.twimg.com/media/GaLI8iGaoAAL2xZ.jpg","","in","","0","0","0","https://x.com/SaguKeju8/status/1847259761299034585","1424746853346660357","SaguKeju8"
"1847091444928204986","Fri Oct 18 12:52:17 +0000 2024","1","@TOM5helby Optimis dong....Mas Pram dan Bang Doel pasti bisa bikin harapan warga #JakartaMenyala","1847259407429832705","","TOM5helby","in","Indonesia","0","0","0","https://x.com/Asnawi___/status/1847259407429832705","1456511192336273410","Asnawi___"
"1847259089216438594","Fri Oct 18 12:51:01 +0000 2024","0","Pramono Anung sangat peduli terhadap masyarakat kelas menengah ke bawah yang sering kali kesulitan dalam mengakses informasi penting seperti KJS &amp; KJP #JakartaMenyala https://t.co/A7nug3JU7J","1847259089216438594","https://pbs.twimg.com/media/GaLIG05b0AAOyCr.jpg","","in","","0","0","0","https://x.com/SaguKeju8/status/1847259089216438594","1424746853346660357","SaguKeju8"
"1847258181405417735","Fri Oct 18 12:47:25 +0000 2024","0","Pramono Anung - Rano Karno percaya bahwa dengan memberikan akses informasi yang lebih baik masyarakat akan lebih terlibat dalam proses pengambilan keputusan sehingga menciptakan pemerintahan yang lebih responsif dan akuntabel #JakartaMenyala https://t.co/Ac12urnrrd","1847258181405417735","https://pbs.twimg.com/media/GaLHhM6bAAADqCb.jpg","","in","","0","0","0","https://x.com/SaguKeju8/status/1847258181405417735","1424746853346660357","SaguKeju8"
"1847258154662596671","Fri Oct 18 12:47:19 +0000 2024","14","Calon gubernur pada Pilkada DKI Jakarta 2024 nomor urut tiga Pramono Anung berjanji mengevaluasi retribusi dan mengatasi proyek mangkrak Pasar Munjul untuk memenuhi harapan rakyat. #JakartaMenyala #PrakarUntukJakarta https://t.co/9pD0Z5hW0U","1847258154662596671","https://pbs.twimg.com/ext_tw_video_thumb/1847258104016375808/pu/img/Zx_ezq51I8i9EiTJ.jpg","","in","Pontianak, Indonesia","0","1","10","https://x.com/Sukapuring/status/1847258154662596671","2400850110","Sukapuring"
"1847257914458640717","Fri Oct 18 12:46:21 +0000 2024","0","Dalam upayanya untuk memajukan Jakarta Pramono Anung menekankan bahwa keterbukaan informasi publik adalah hal yang mutlak diperlukan #JakartaMenyala https://t.co/5q2DIZ4gFG","1847257914458640717","https://pbs.twimg.com/media/GaLHRqVbsAAaKyQ.jpg","","in","","0","0","0","https://x.com/SaguKeju8/status/1847257914458640717","1424746853346660357","SaguKeju8"
"1847257557611753640","Fri Oct 18 12:44:56 +0000 2024","0","Dengan visi yang jelas Pramono Anung bertekad menjadikan Jakarta sebagai kota global yang lebih terbuka dan inklusif. Pendekatan ini sangat penting untuk memastikan bahwa semua lapisan masyarakat dapat mengakses informasi yang mereka butuhkan #JakartaMenyala https://t.co/7UQUd17UaB","1847257557611753640","https://pbs.twimg.com/media/GaLG8TpboAAYK3w.jpg","","in","","0","0","0","https://x.com/SaguKeju8/status/1847257557611753640","1424746853346660357","SaguKeju8"
"1847257308629504434","Fri Oct 18 12:43:57 +0000 2024","0","Pramono Anung: Pemimpin yang Mengedepankan Transparansi #JakartaMenyala Pramono Anung calon gubernur Jakarta nomor urut 3 menunjukkan komitmen yang kuat untuk meningkatkan transparansi dan keterbukaan informasi publik. https://t.co/TlrmUOFqZL","1847257308629504434","https://pbs.twimg.com/media/GaLGuXUbsAAowOj.jpg","","in","","0","0","0","https://x.com/SaguKeju8/status/1847257308629504434","1424746853346660357","SaguKeju8"
"1847095514837537167","Fri Oct 18 12:39:30 +0000 2024","0","@KangManto123 #JakartaMenyala Bersama PRAMDOEL ","1847256190998520268","","KangManto123","in","","0","0","0","https://x.com/Nyawang_wulan/status/1847256190998520268","1405381720803667973","Nyawang_wulan"
"1847255692438360412","Fri Oct 18 12:37:32 +0000 2024","1","Jika terpilih nanti Mas Pram berkomitmen utk membangun SLB di daerah Jakarta Utara. Berkeadilan utk semua golongan masyarakat. #JakartaMenyala #PramDoelMenang #Salam3Jari https://t.co/IKeuKUsl0p","1847255692438360412","https://pbs.twimg.com/media/GaLFQQSbEAA9B1F.jpg","","in","indonesia","1","0","1","https://x.com/LinNasution/status/1847255692438360412","1089167212638687232","LinNasution"
"1847255146591576213","Fri Oct 18 12:35:21 +0000 2024","35","Dengarkan keluhan pedagang yang mengalami kesulitan modal usaha Pak Pramono Anung memastikan akan menyiapkan dan hibah untuk UMKM. Mantap Pramono Anung - Rano Karno semakin menyala. #JakartaMenyala #PrakarUntukJakarta https://t.co/uRRYF3L71h","1847255146591576213","https://pbs.twimg.com/media/GaLEwm8b0AANj7D.jpg","","in","Indonesia","0","2","22","https://x.com/seruanhl/status/1847255146591576213","1174287141909590017","seruanhl"
"1847254549641494962","Fri Oct 18 12:32:59 +0000 2024","0","Hunian di atas kantor ala Mas Pram dan Bang Doel #jakartamenyala #pramonoanung #ranokarno https://t.co/pGUCuVLuoc","1847254549641494962","https://pbs.twimg.com/ext_tw_video_thumb/1847254468137746432/pu/img/MzzoBinJDrsYkBTy.jpg","","in","","0","0","0","https://x.com/oposan62id/status/1847254549641494962","1454858092143779845","oposan62id"
"1847253988015530125","Fri Oct 18 12:30:45 +0000 2024","121","Dua tokoh Betawi nih Oneng &amp; Bang Doel Sama2 dicintai &amp; didukung masy Jakarta... Yg jelas 2 tokoh ini memperjuangkan rakyat di ranahnya masing2.. Mas Pram Bang Doel bakan bikin #JakartaMenyala Ga kaleng2 https://t.co/fEf7tXnTXE","1847253988015530125","https://pbs.twimg.com/ext_tw_video_thumb/1847253876938006528/pu/img/IsurTez45q6LNx4T.jpg","","in","","0","2","36","https://x.com/Jelli_cent/status/1847253988015530125","2669430458","Jelli_cent"
"1847252830731776253","Fri Oct 18 12:29:39 +0000 2024","3","@AntoniusCDN @pramonoanung @detikcom @03__nakula @Anak__Ogi @JhonSitorus_18 @NgkongRoses @Urrangawak @seruanhl @HumorJonTampan @ch_chotimah2 @DS_yantie Congratulation Mas Pram untuk #JakartaMenyala","1847253711703392272","","AntoniusCDN","in","ðŸ‡®ðŸ‡©","0","1","2","https://x.com/elsaday__/status/1847253711703392272","1316243860280889345","elsaday__"
"1847253583705903518","Fri Oct 18 12:29:09 +0000 2024","12","Saking Ngebet Menang jadi Gubernur Jakarta nih cuy! dari Kang Emil jadi Bang Emil Jangan maksain diri MEMBETAWINISASI Kang Emil .. Agak laen emang Pram-Doel #JakartaMenyala #PrakarUntukJakarta Abidzar Hamas Yahya Sinwar Erina Bahrain Bahlil Liam Payne Omakase Bluesky https://t.co/9pBdmQCyGf","1847253583705903518","https://pbs.twimg.com/ext_tw_video_thumb/1847253544098996224/pu/img/9VfBhllrAOE0mcu4.jpg","","in","Indonesia","0","4","7","https://x.com/NyaiKhonguan/status/1847253583705903518","2266877797","NyaiKhonguan"
"1847252830731776253","Fri Oct 18 12:26:09 +0000 2024","44","Selamat atas terpilihnya Mas @pramonoanung sebagai tokoh pemimpin kolaboratif dalam acara @detikcom awards 2024 semoga bila #PrakarUntukJakarta terpilih nantinya sebagai pemimpin DKJ bisa merangkul semua masyarakat utk senantiasa mewujudkan #JakartaMenyala _____ Ridwan Kamil https://t.co/UI7hP1wiBu","1847252830731776253","https://pbs.twimg.com/ext_tw_video_thumb/1847252789946458112/pu/img/zxj7jjOo5Ghco7hs.jpg","","in","","1","7","30","https://x.com/AntoniusCDN/status/1847252830731776253","4184979312","AntoniusCDN"
"1847252791158522226","Fri Oct 18 12:26:00 +0000 2024","12","Mas Pram memuji keuletan dan tekad warga Madura di Jakarta. #JakartaMenyala gak pake ribet!! https://t.co/qtHHFdoKFV","1847252791158522226","https://pbs.twimg.com/ext_tw_video_thumb/1847216690687520768/pu/img/Y06gmAKe80P-_0Fc.jpg","","in","","0","2","5","https://x.com/Y_Radianto/status/1847252791158522226","1529772993530167297","Y_Radianto"
"1847252220791705904","Fri Oct 18 12:23:44 +0000 2024","0","Warga Jakarta pilih Mas Pram dan Bang Doel #jakartamenyala #pramdoelmenang #pramonoanung #ranokarno https://t.co/QefbT8TnKv","1847252220791705904","https://pbs.twimg.com/ext_tw_video_thumb/1847252163489357824/pu/img/27NLgfMoFAV0x7gN.jpg","","in","","0","0","0","https://x.com/oposan62id/status/1847252220791705904","1454858092143779845","oposan62id"
"1847252202601296046","Fri Oct 18 12:23:40 +0000 2024","0","Pramono Anung - Rano Karno mengusung program yang sejalan dengan konsep kota global #JakartaMenyala Benyamin S Award mencerminkan komitmen mereka untuk menciptakan Jakarta yang bersih nyaman dan indah. https://t.co/8uCu7hJSO5","1847252202601296046","https://pbs.twimg.com/media/GaLCFBSboAAb9Bn.jpg","","in","","0","0","0","https://x.com/iimwarga062/status/1847252202601296046","1693214501330620417","iimwarga062"
"1847251742561640469","Fri Oct 18 12:21:50 +0000 2024","4","Kang Emil.... ngupi sachetan aja yuuuk... Ribet hiiih !! Biarin #JakartaMenyala bersama #PrakarUntukJakarta saja... Nda ribet sih kalau sama mereka !! https://t.co/hge28Y6rB9","1847251742561640469","https://pbs.twimg.com/ext_tw_video_thumb/1847251648021954560/pu/img/YSKncsJ9ZvGR7eHh.jpg","","in","","0","3","4","https://x.com/siapanamina/status/1847251742561640469","1402653576090984450","siapanamina"
"1847250843630010666","Fri Oct 18 12:18:16 +0000 2024","2","JAKARTA MENYALA #JakartaMenyala ---- FIFA Presiden AFC Bahrain https://t.co/DGAq51e7h6","1847250843630010666","https://pbs.twimg.com/media/GaLA2ljaQAA72mn.jpg","","in","","0","0","0","https://x.com/rafaaniii_/status/1847250843630010666","1395567537794863104","rafaaniii_"
"1847250708631814532","Fri Oct 18 12:17:43 +0000 2024","0","Hanya Pram dan Doel yang Bisa Kolaboratif. Ridwan Kamil diminta pulang oleh pedang Pasar Cipulir. #JakartaMenyala afcmafia Bahrain MotoGP Hamas #TumbangkanFufufa https://t.co/9PHYcqxKYi","1847250708631814532","https://pbs.twimg.com/ext_tw_video_thumb/1847250442172133376/pu/img/-XfbSY49RdCcA2Ft.jpg","","in","","0","0","0","https://x.com/oposan62id/status/1847250708631814532","1454858092143779845","oposan62id"
"1847250120431267847","Fri Oct 18 12:15:23 +0000 2024","1","Komitmen Mas Pram akan melanjutkan Pembangunan Gedung Pasar Munjul apabila beliau terpilih menjadi Gubernur Jakarta #JakartaMenyala --- Presiden AFC FIFA omakaze Erina Mantu https://t.co/m2rn7uL6BJ","1847250120431267847","https://pbs.twimg.com/media/GaLAMfSbMAA0EBa.jpg","","in","","0","0","0","https://x.com/rafaaniii_/status/1847250120431267847","1395567537794863104","rafaaniii_"
"1847247915104002444","Fri Oct 18 12:06:37 +0000 2024","9","Wow.. Program Makan Siang.? Bukannya itu Program Presiden yg dipilih sama gRombolan Batre Kembung? Kenapa jadi Ridwan Kamil yg hrs ngeBACOD..? ehhh BARCODE..? Dah lah yg Pasti Pasti aja program nya Cagub Cawagub No 3 Mas Pram dan Bang Doel #JakartaMenyala Malam Sabtu https://t.co/y58wg37Gbe","1847247915104002444","https://pbs.twimg.com/media/GaK-MJRbwAA5KOO.jpg","","in","East Java, Indonesia","1","4","6","https://x.com/cahcilich/status/1847247915104002444","3287370456","cahcilich"
"1847247809524924879","Fri Oct 18 12:06:12 +0000 2024","0","Tebak judul film yang di-remake jadi poster-poster ini. Udah nonton film-filmnya? @pramonoanungw @si.rano #PramonoAnung #RanoKarno #MasPramBangDoel #JakartaMenyala #PosterFilm https://t.co/SkcUXeiKkn","1847247809524924879","https://pbs.twimg.com/media/GaK-F6_awAALFti.jpg","","in","","0","0","0","https://x.com/Sambera31816/status/1847247809524924879","1805992598487924736","Sambera31816"
"1847247629165764675","Fri Oct 18 12:05:29 +0000 2024","0","Ide kreatif mas pram Hunian di atas kantor mempermudah kita semua. #programpramdoel #jakartamenyala https://t.co/26qrQfX1Yw","1847247629165764675","https://pbs.twimg.com/ext_tw_video_thumb/1847247518087938048/pu/img/65jAYasOrQtWs8jx.jpg","","in","","0","0","0","https://x.com/Sambera31816/status/1847247629165764675","1805992598487924736","Sambera31816"
"1847247074099941583","Fri Oct 18 12:03:17 +0000 2024","25","Bantar Gebang mau diapakan? Nanya Mas @pramonoanung? Jelas blio tau persis apa yg akan dilakukan. PLTS!! Pembangkit Listrik Tenaga Sampah Kendalanya diatasi Transparansi.. Pejabat yg mikirin rakyat itu mo apa2 enteng.. ga beban. Mas Pram Bang Doel u/ #JakartaMenyala https://t.co/vdwQS8PBc0","1847247074099941583","https://pbs.twimg.com/ext_tw_video_thumb/1847247032647598080/pu/img/_C7ohdGiELC8PqOr.jpg","","in","","0","0","12","https://x.com/Jelli_cent/status/1847247074099941583","2669430458","Jelli_cent"
"1847245835517763950","Fri Oct 18 11:58:22 +0000 2024","0","Mas pram usulkan bir pletok sebagai minuman ciri khas jakarta #pramdoelmenang #jakartamenyala https://t.co/lfXUAw8DoR","1847245835517763950","https://pbs.twimg.com/ext_tw_video_thumb/1847245600783577089/pu/img/OvkcPPgjD1Qmjp_h.jpg","","in","","0","0","0","https://x.com/Sambera31816/status/1847245835517763950","1805992598487924736","Sambera31816"
"1847242277107982796","Fri Oct 18 11:44:13 +0000 2024","0","Solusi cerdas buat kaum milenial Jakarta yg belum punya tempat tinggal di jakarta. Program ini nantinya bikin kita lbh efisien Fleksibel dan tentunya dgn harga yg lbh terjangkau. Mantap ! #JakartaMenyala https://t.co/xUGPHdhjPI","1847242277107982796","https://pbs.twimg.com/ext_tw_video_thumb/1847242204806553600/pu/img/ukCndcdV6nqhEg1E.jpg","","in","indonesia","0","0","0","https://x.com/LinNasution/status/1847242277107982796","1089167212638687232","LinNasution"
"1847241737653137578","Fri Oct 18 11:42:05 +0000 2024","1","Mantap #JakartaMenyala","1847241737653137578","","","in","Jatinegara, Indonesia","0","0","0","https://x.com/Dodyeonn/status/1847241737653137578","1449335159874940929","Dodyeonn"
"1847241719479505287","Fri Oct 18 11:42:00 +0000 2024","14","Jangan lupa gaess... Nonton #JakartaMenyala Pramono-Rano Siap Memimpin Jakarta Jumat 18 Oktober 2024 Pukul 21.00 WIB Streaming on Garuda TV. #PrakarUntukJakarta https://t.co/p9fIJOp1n5","1847241719479505287","https://pbs.twimg.com/ext_tw_video_thumb/1847241701985062912/pu/img/VqSWo6cYYHMa37ON.jpg","","in","","0","2","9","https://x.com/kenhans03/status/1847241719479505287","3270403033","kenhans03"
"1847241665259712997","Fri Oct 18 11:41:47 +0000 2024","13","Solusi jitu Mas Pram dan Bang Doel untuk mengatasi masalah tempat tinggal yg mahal di Jakarta sekaligus menyediakan ruang kreatif buat penghuninya #JakartaMenyala #PrakarUntukJakarta https://t.co/VBH7jZmS2J","1847241665259712997","https://pbs.twimg.com/ext_tw_video_thumb/1847241578555088896/pu/img/OwbuSUSOqiNEgzx7.jpg","","in","Jakarta Raya","1","1","12","https://x.com/FirzaHusainID/status/1847241665259712997","849562015882465280","FirzaHusainID"
"1847240699835531447","Fri Oct 18 11:37:57 +0000 2024","70","Pramono Anung Blusukan ke Pasar Munjul Jaktim Pedagang Curhat Omzet Turun. Dengarkan lalu berikan solusi pemimpin.ï¸ #JakartaMenyala https://t.co/cDb00w1ST2 https://t.co/vrLlmeoczD","1847240699835531447","https://pbs.twimg.com/ext_tw_video_thumb/1847240633301577728/pu/img/lUCnUXmZ-RefESOp.jpg","","in","Kalimantan Timur, Indonesia","2","0","21","https://x.com/ch_chotimah2/status/1847240699835531447","154435354","ch_chotimah2"
"1847240430339154262","Fri Oct 18 11:36:53 +0000 2024","0","UMKM tidak luput dari target Mas Pram utk dimajukan kala jadi Gubernur Jakarta kedepan. #JakartaMenyala https://t.co/SLFSKW0muO","1847240430339154262","https://pbs.twimg.com/media/GaK3YLYboAAuGWk.jpg","","in","Jakarta Selatan, DKI Jakarta","0","0","0","https://x.com/Aan_Hantorov/status/1847240430339154262","1006831238961754112","Aan_Hantorov"
"1847240337426944236","Fri Oct 18 11:36:31 +0000 2024","6","Iyeeeess...... Tooosss kita atas #PrakarUntukJakarta utk bergerak bersama... bertindak bersama mewujudkan #JakartaMenyala https://t.co/JPk95gGNqr","1847240337426944236","https://pbs.twimg.com/ext_tw_video_thumb/1847240211543334912/pu/img/DAnREMHkC4O9QonH.jpg","","in","","0","2","6","https://x.com/siapanamina/status/1847240337426944236","1402653576090984450","siapanamina"
"1847238889993588825","Fri Oct 18 11:30:46 +0000 2024","17","Menurut @pramonoanung warung Madura selalu bukaÂ 24 jamÂ merupakan hak hidup warga Madura sekaligus mata pencaharian mereka. Namun yang penting kata dia mereka bisa memberikan manfaat kepada semuanya. #JakartaMenyala #PrakarUntukJakarta https://t.co/GLlrS44lEc","1847238889993588825","https://pbs.twimg.com/ext_tw_video_thumb/1847238813976076288/pu/img/K9LIQ1ZjeILXMgCV.jpg","","in","Pontianak, Indonesia","0","1","13","https://x.com/Sukapuring/status/1847238889993588825","2400850110","Sukapuring"
